{
  "catalog_id": "compute-device-presets",
  "catalog_version": "v0.1.2",
  "catalog_notes": "Updated session 6. Added 8 sourced device entries. Retained existing preset_ids for backward compat. All temp/flux/mass values marked research_required=true; sourced from published datasheets where available, estimated elsewhere. Constraint-validated against spec \u00a716.2. v0.1.2 session 6: NVIDIA cp_max updated to 318K (sourced OEM). OAM mass updated to 2.0kg (OCP spec). HOLE-CAT-001 closed.",
  "entries": [
    {
      "preset_id": "gpu_h200_class",
      "label": "H200-Class GPU (SXM5 Analog, updated v0.1.1)",
      "vendor": "nvidia_analog",
      "family": "h200_class",
      "sku": "h200_sxm5_analog",
      "device_type": "gpu",
      "nominal_tdp_w": 700,
      "peak_tdp_w": 700,
      "allowable_junction_temp_k": 368,
      "allowable_package_temp_k": 358,
      "allowable_coldplate_temp_min_k": 253,
      "allowable_coldplate_temp_max_k": 318,
      "heat_flux_w_per_cm2": 85,
      "power_idle_w": 60,
      "power_light_w": 175,
      "power_medium_w": 390,
      "power_full_w": 700,
      "package_mass_kg": 1.5,
      "maturity_class": "flight_proven_analog",
      "thermal_grade": "commercial_plus",
      "cooling_pickup_class": "cold_plate",
      "pickup_geometry": "single_sided_cold_plate",
      "performance_basis_note": "Based on NVIDIA H200 SXM5 published TDP and form factor. Partial-load power, temps, and mass are research estimates. Not a qualified space part.",
      "thermal_basis_note": "Junction Tj_max ~95C (368K) from NVIDIA Hopper thermal guidance. Cold-plate inlet max 45\u00b0C (318K) per OEM HGX liquid-cooling docs (Lenovo SR780a V3, Gigabyte G363-ZR0, Aivres KR6288V2). HOLE-CAT-001 closed. from package to coolant. TIM resistance included in package-temp budget.",
      "packaging_notes": "SXM5 module on HGX baseboard. Custom carrier required for spacecraft integration. Updated from v0.1.0 with session-6 research data.",
      "research_required": true
    },
    {
      "preset_id": "gpu_h100_sxm5",
      "label": "NVIDIA H100 SXM5 (Hopper, 80GB HBM3)",
      "vendor": "nvidia",
      "family": "hopper",
      "sku": "h100_sxm5",
      "device_type": "gpu",
      "nominal_tdp_w": 700,
      "peak_tdp_w": 700,
      "allowable_junction_temp_k": 368,
      "allowable_package_temp_k": 358,
      "allowable_coldplate_temp_min_k": 253,
      "allowable_coldplate_temp_max_k": 318,
      "heat_flux_w_per_cm2": 85,
      "power_idle_w": 60,
      "power_light_w": 175,
      "power_medium_w": 390,
      "power_full_w": 700,
      "package_mass_kg": 1.5,
      "maturity_class": "flight_proven_analog",
      "thermal_grade": "commercial_plus",
      "cooling_pickup_class": "cold_plate",
      "pickup_geometry": "single_sided_cold_plate",
      "performance_basis_note": "TDP and form factor from NVIDIA H100 product page. GH100 die ~814mm2 (Hopper architecture material). Partial-load powers, temps, and mass estimated from SXM5 thermal guidance.",
      "thermal_basis_note": "Tj_max ~95C (368K) per NVIDIA Hopper thermal docs. Cold-plate inlet max 45\u00b0C (318K) per OEM HGX liquid-cooling docs. HOLE-CAT-001 closed.. Same thermal class as H200 SXM5; HBM3 vs HBM3e is the primary hardware distinction.",
      "packaging_notes": "SXM5 module. 80GB HBM3, 3.35 TB/s bandwidth. HGX H100 baseboard integration. Not space-qualified.",
      "research_required": true
    },
    {
      "preset_id": "gpu_a100_sxm4_80gb",
      "label": "NVIDIA A100 SXM4 80GB (Ampere, HBM2e)",
      "vendor": "nvidia",
      "family": "ampere",
      "sku": "a100_sxm4_80gb",
      "device_type": "gpu",
      "nominal_tdp_w": 400,
      "peak_tdp_w": 400,
      "allowable_junction_temp_k": 358,
      "allowable_package_temp_k": 348,
      "allowable_coldplate_temp_min_k": 253,
      "allowable_coldplate_temp_max_k": 318,
      "heat_flux_w_per_cm2": 48,
      "power_idle_w": 40,
      "power_light_w": 100,
      "power_medium_w": 225,
      "power_full_w": 400,
      "package_mass_kg": 1.3,
      "maturity_class": "flight_proven_analog",
      "thermal_grade": "commercial_plus",
      "cooling_pickup_class": "cold_plate",
      "pickup_geometry": "single_sided_cold_plate",
      "performance_basis_note": "TDP 400W from NVIDIA A100 datasheet (SXM4 variant). GA100 die ~826mm2 from Ampere architecture whitepaper; heat flux derived from die area. Partial loads and mass estimated.",
      "thermal_basis_note": "Tj_max ~85C (358K). Heat flux 48 W/cm2 is die-level estimate from published GA100 die size. Cold-plate delta-T budget 20K. Lower heat flux vs H100/H200 due to larger die.",
      "packaging_notes": "SXM4 module. 80GB HBM2e, 2.039 TB/s bandwidth. Reference class for legacy fleet comparison. Not space-qualified.",
      "research_required": true
    },
    {
      "preset_id": "gpu_amd_mi300x",
      "label": "AMD Instinct MI300X (CDNA3, 192GB HBM3)",
      "vendor": "amd",
      "family": "cdna3",
      "sku": "mi300x",
      "device_type": "gpu",
      "nominal_tdp_w": 750,
      "peak_tdp_w": 750,
      "allowable_junction_temp_k": 373,
      "allowable_package_temp_k": 358,
      "allowable_coldplate_temp_min_k": 253,
      "allowable_coldplate_temp_max_k": 338,
      "heat_flux_w_per_cm2": 90,
      "power_idle_w": 68,
      "power_light_w": 188,
      "power_medium_w": 424,
      "power_full_w": 750,
      "package_mass_kg": 2.0,
      "maturity_class": "flight_proven_analog",
      "thermal_grade": "commercial_plus",
      "cooling_pickup_class": "cold_plate",
      "pickup_geometry": "single_sided_cold_plate",
      "performance_basis_note": "Maximum TBP 750W from AMD MI300X datasheet. Multi-chip package with 8 XCDs. OAM form factor. Heat flux is estimated; AMD does not publish chiplet-level flux in open datasheets. heat_flux_w_per_cm2 not published by vendor; value is die-area scaling estimate. DIFF-CAT-003.",
      "thermal_basis_note": "Junction slowdown threshold ~100C (373K) per AMD SMI monitoring data. Package temp (358K) derived from OAM thermal budget. Cold-plate delta-T budget 20K. Mass is average of S1/S2 research estimates.",
      "packaging_notes": "OAM module. 192GB HBM3, 5.3 TB/s bandwidth. Multi-die package requires OAM carrier. Not space-qualified. Mass 2.0kg per OCP OAM spec upper bound (OAM+heatsink); bare module mass not publicly stated. DIFF-CAT-004 updated.",
      "research_required": true
    },
    {
      "preset_id": "gpu_amd_mi250x",
      "label": "AMD Instinct MI250X (CDNA2, 128GB HBM2e)",
      "vendor": "amd",
      "family": "cdna2",
      "sku": "mi250x",
      "device_type": "gpu",
      "nominal_tdp_w": 500,
      "peak_tdp_w": 560,
      "allowable_junction_temp_k": 373,
      "allowable_package_temp_k": 358,
      "allowable_coldplate_temp_min_k": 253,
      "allowable_coldplate_temp_max_k": 338,
      "heat_flux_w_per_cm2": 75,
      "power_idle_w": 50,
      "power_light_w": 133,
      "power_medium_w": 296,
      "power_full_w": 500,
      "package_mass_kg": 2.0,
      "maturity_class": "flight_proven_analog",
      "thermal_grade": "commercial_plus",
      "cooling_pickup_class": "cold_plate",
      "pickup_geometry": "single_sided_cold_plate",
      "performance_basis_note": "Nominal TDP 500W typical / 560W peak per AMD MI250X product page. Dual-die CDNA2 OAM package. Heat flux estimated from prior-gen die scaling. Partial loads averaged from two research sources. heat_flux_w_per_cm2 not published by vendor; value is die-area scaling estimate. DIFF-CAT-003.",
      "thermal_basis_note": "Junction slowdown ~100C (373K) from AMD SMI. nominal 500W chosen as design-point load; 560W peak for burst. power_full_w set to nominal to avoid overstate in steady-state trade. Not space-qualified.",
      "packaging_notes": "OAM module. 128GB HBM2e, 3.2 TB/s bandwidth. CDNA2 dual-die package. Not space-qualified. Mass 2.0kg per OCP OAM spec upper bound (OAM+heatsink); bare module mass not publicly stated. DIFF-CAT-004 updated.",
      "research_required": true
    },
    {
      "preset_id": "gpu_intel_gaudi3",
      "label": "Intel Gaudi 3 (HPU OAM 2.0, 128GB HBM2E)",
      "vendor": "intel",
      "family": "gaudi3",
      "sku": "hl325l_oam",
      "device_type": "accelerator",
      "nominal_tdp_w": 900,
      "peak_tdp_w": 900,
      "allowable_junction_temp_k": 368,
      "allowable_package_temp_k": 353,
      "allowable_coldplate_temp_min_k": 253,
      "allowable_coldplate_temp_max_k": 333,
      "heat_flux_w_per_cm2": 95,
      "power_idle_w": 80,
      "power_light_w": 225,
      "power_medium_w": 500,
      "power_full_w": 900,
      "package_mass_kg": 2.0,
      "maturity_class": "experimental",
      "thermal_grade": "commercial_plus",
      "cooling_pickup_class": "cold_plate",
      "pickup_geometry": "single_sided_cold_plate",
      "performance_basis_note": "TDP 900W and OAM 2.0 form factor from Intel Gaudi 3 OAM product brief and technical paper. Heat flux estimated from 5nm die scaling. Partial loads averaged from two research sources. heat_flux_w_per_cm2 not published by vendor; value is die-area scaling estimate. DIFF-CAT-003.",
      "thermal_basis_note": "Tj_max ~95C (368K) by analogy to Intel data center thermal guidance. OAM 2.0 cold-plate budget 20K. Highest TDP in catalog; radiator burden dominant device for 50kW class trade.",
      "packaging_notes": "OCP OAM 2.0 mezzanine card. 128GB HBM2E, 3.7 TB/s. Two compute dies. Less flight-heritage analog than NVIDIA SXM class; marked experimental. Not space-qualified. Mass 2.0kg per OCP OAM spec upper bound (OAM+heatsink); bare module mass not publicly stated. DIFF-CAT-004 updated.",
      "research_required": true
    },
    {
      "preset_id": "gpu_intel_gaudi2",
      "label": "Intel Gaudi 2 (HPU OAM 1.1, 96GB HBM2e)",
      "vendor": "intel",
      "family": "gaudi2",
      "sku": "hl225_oam",
      "device_type": "accelerator",
      "nominal_tdp_w": 600,
      "peak_tdp_w": 600,